Model/System,Researcher,Accuracy (%),Processing (ms),Real-time,Features
Machine Learning (Patil),Patil et al. (2025),78.5,450.0,✗,"Manual feature extraction, SVM/Random Forest..."
Canny Edge Detection (Ballado),Ballado et al. (2022),82.4,120.0,✗,Edge-based security feature detection...
Image Processing (Apoloni),Apoloni et al. (2022),84.2,180.0,✗,Multiple image processing techniques...
CNN + Image Proc (Noor),Noor & Ruhaiyem (2025),92.0,65.0,✓,Hybrid image processing + CNN...
PesoScan Complete (OURS),PesoScan Team (2025),96.8,180.0,✓,Multi-model pipeline: Detection + Classification +...
